date,sleep_minutes,exercise_minutes,mood_scale,mood_tags,activities,notes
2000-01-01,480,180,7.0,ok,watched tv,
2000-01-02,360,25,6.0,ok,nothing,"i didn't do much, didn't do little either, just did a bit"
2004-06-01,1440,120,10.0,"new, born, newborn","crying, being young, being a baby",I was born
2012-10-15,600,0,10.0,"happy, excited","going to hospital, seeing my new sister",my sister was born
2026-01-01,300,20,6.0,"depressed, waiting","played pickleball, did some music stuff",on vacation and i can't wait to get home
